title,session,authors,affiliations,pdf_url
Generating 3D Bio-Printable Patches Using Wound Segmentation and Reconstruction To Treat Diabetic Foot Ulcers,Vision Applications & Systems,"['Han Joo Chae', 'Seunghwan Lee']",['ROKIT'],https://openaccess.thecvf.com/content/CVPR2022/papers/Chae_Generating_3D_Bio-Printable_Patches_Using_Wound_Segmentation_and_Reconstruction_To_CVPR_2022_paper.pdf
Graph-Context Attention Networks for Size-Varied Deep Graph Matching,Vision Applications & Systems,"['Zheheng Jiang', 'Hossein Rahmani']",['Lancaster'],https://openaccess.thecvf.com/content/CVPR2022/papers/Jiang_Graph-Context_Attention_Networks_for_Size-Varied_Deep_Graph_Matching_CVPR_2022_paper.pdf
Image Disentanglement Autoencoder for Steganography Without Embedding,Vision Applications & Systems,"['Xiyao Liu', 'Ziping Ma']",['CSU'],https://openaccess.thecvf.com/content/CVPR2022/papers/Liu_Image_Disentanglement_Autoencoder_for_Steganography_Without_Embedding_CVPR_2022_paper.pdf
Investigating the Impact of Multi-LiDAR Placement on Object Detection for Autonomous Driving,Vision Applications & Systems,"['Hanjiang Hu', 'Zuxin Liu']",['CMU'],https://openaccess.thecvf.com/content/CVPR2022/papers/Hu_Investigating_the_Impact_of_Multi-LiDAR_Placement_on_Object_Detection_for_CVPR_2022_paper.pdf
It's About Time: Analog Clock Reading in the Wild,Vision Applications & Systems,"['Charig Yang', 'Weidi Xie']",['Oxford'],https://openaccess.thecvf.com/content/CVPR2022/papers/Yang_Its_About_Time_Analog_Clock_Reading_in_the_Wild_CVPR_2022_paper.pdf
Large-Scale Pre-Training for Person Re-Identification With Noisy Labels,Vision Applications & Systems,"['Dengpan Fu', 'Dongdong Chen']",['USTC'],https://openaccess.thecvf.com/content/CVPR2022/papers/Fu_Large-Scale_Pre-Training_for_Person_Re-Identification_With_Noisy_Labels_CVPR_2022_paper.pdf
Learning Invisible Markers for Hidden Codes in Offline-to-Online Photography,Vision Applications & Systems,"['Jun Jia', 'Zhongpai Gao']",['SJTU'],https://openaccess.thecvf.com/content/CVPR2022/papers/Jia_Learning_Invisible_Markers_for_Hidden_Codes_in_Offline-to-Online_Photography_CVPR_2022_paper.pdf
Long-Term Visual Map Sparsification With Heterogeneous GNN,Vision Applications & Systems,"['Ming-Fang Chang', 'Yipu Zhao']",['CMU'],https://openaccess.thecvf.com/content/CVPR2022/papers/Chang_Long-Term_Visual_Map_Sparsification_With_Heterogeneous_GNN_CVPR_2022_paper.pdf
Meta Distribution Alignment for Generalizable Person Re-Identification,Vision Applications & Systems,"['Hao Ni', 'Jingkuan Song']",['UESTC'],https://openaccess.thecvf.com/content/CVPR2022/papers/Ni_Meta_Distribution_Alignment_for_Generalizable_Person_Re-Identification_CVPR_2022_paper.pdf
ObjectFormer for Image Manipulation Detection and Localization,Vision Applications & Systems,"['Junke Wang', 'Zuxuan Wu']",['Fudan'],https://openaccess.thecvf.com/content/CVPR2022/papers/Wang_ObjectFormer_for_Image_Manipulation_Detection_and_Localization_CVPR_2022_paper.pdf
Partially Does It: Towards Scene-Level FG-SBIR With Partial Input,Vision Applications & Systems,"['Pinaki Nath Chowdhury', 'Ayan Kumar Bhunia']",['Surrey'],https://openaccess.thecvf.com/content/CVPR2022/papers/Chowdhury_Partially_Does_It_Towards_Scene-Level_FG-SBIR_With_Partial_Input_CVPR_2022_paper.pdf
Rethinking Image Cropping: Exploring Diverse Compositions From Global Views,Vision Applications & Systems,"['Gengyun Jia', 'Huaibo Huang']",['UCAS'],https://openaccess.thecvf.com/content/CVPR2022/papers/Jia_Rethinking_Image_Cropping_Exploring_Diverse_Compositions_From_Global_Views_CVPR_2022_paper.pdf
Semi-Supervised Video Paragraph Grounding With Contrastive Encoder,Vision Applications & Systems,"['Xun Jiang', 'Xing Xu']",['UESTC'],https://openaccess.thecvf.com/content/CVPR2022/papers/Jiang_Semi-Supervised_Video_Paragraph_Grounding_With_Contrastive_Encoder_CVPR_2022_paper.pdf
Semiconductor Defect Detection by Hybrid Classical-Quantum Deep Learning,Vision Applications & Systems,"['Yuan-Fu Yang', 'Min Sun']",['NTHU'],https://openaccess.thecvf.com/content/CVPR2022/papers/Yang_Semiconductor_Defect_Detection_by_Hybrid_Classical-Quantum_Deep_Learning_CVPR_2022_paper.pdf
Sequential Voting With Relational Box Fields for Active Object Detection,Vision Applications & Systems,"['Qichen Fu', 'Xingyu Liu']",['CMU'],https://openaccess.thecvf.com/content/CVPR2022/papers/Fu_Sequential_Voting_With_Relational_Box_Fields_for_Active_Object_Detection_CVPR_2022_paper.pdf
SmartAdapt: Multi-Branch Object Detection Framework for Videos on Mobiles,Vision Applications & Systems,"['Ran Xu', 'Fangzhou Mu']",['Purdue'],https://openaccess.thecvf.com/content/CVPR2022/papers/Xu_SmartAdapt_Multi-Branch_Object_Detection_Framework_for_Videos_on_Mobiles_CVPR_2022_paper.pdf
TransWeather: Transformer-Based Restoration of Images Degraded by Adverse Weather Conditions,Vision Applications & Systems,"['Jeya Maria Jose Valanarasu', 'Rajeev Yasarla']",['JHU'],https://openaccess.thecvf.com/content/CVPR2022/papers/Valanarasu_TransWeather_Transformer-Based_Restoration_of_Images_Degraded_by_Adverse_Weather_Conditions_CVPR_2022_paper.pdf
Contextual Debiasing for Visual Recognition With Causal Mechanisms,Visual Reasoning,"['Ruyang Liu', 'Hao Liu']",['PKU'],https://openaccess.thecvf.com/content/CVPR2022/papers/Liu_Contextual_Debiasing_for_Visual_Recognition_With_Causal_Mechanisms_CVPR_2022_paper.pdf
Learning To Anticipate Future With Dynamic Context Removal,Visual Reasoning,"['Xinyu Xu', 'Yong-Lu Li']",['SJTU'],https://openaccess.thecvf.com/content/CVPR2022/papers/Xu_Learning_To_Anticipate_Future_With_Dynamic_Context_Removal_CVPR_2022_paper.pdf
Neural Shape Mating: Self-Supervised Object Assembly With Adversarial Shape Priors,Visual Reasoning,"['Yun-Chun Chen', 'Haoda Li']",['U'],https://openaccess.thecvf.com/content/CVPR2022/papers/Chen_Neural_Shape_Mating_Self-Supervised_Object_Assembly_With_Adversarial_Shape_Priors_CVPR_2022_paper.pdf
Self-Supervised Spatial Reasoning on Multi-View Line Drawings,Visual Reasoning,"['Siyuan Xiang', 'Anbang Yang']",['NYU'],https://openaccess.thecvf.com/content/CVPR2022/papers/Xiang_Self-Supervised_Spatial_Reasoning_on_Multi-View_Line_Drawings_CVPR_2022_paper.pdf
Revisiting Domain Generalized Stereo Matching Networks From a Feature Consistency Perspective,3D From Multi-View & Sensors,"['Jiawei Zhang', 'Xiang Wang']",['Beihang'],https://openaccess.thecvf.com/content/CVPR2022/papers/Zhang_Revisiting_Domain_Generalized_Stereo_Matching_Networks_From_a_Feature_Consistency_CVPR_2022_paper.pdf
RGB-Depth Fusion GAN for Indoor Depth Completion,3D From Multi-View & Sensors,"['Haowen Wang', 'Mingyuan Wang']",['BUPT'],https://openaccess.thecvf.com/content/CVPR2022/papers/Wang_RGB-Depth_Fusion_GAN_for_Indoor_Depth_Completion_CVPR_2022_paper.pdf
"RGB-Multispectral Matching: Dataset, Learning Methodology, Evaluation",3D From Multi-View & Sensors,"['Fabio Tosi', 'Pierluigi Zama Ramirez']",['Unibo'],https://openaccess.thecvf.com/content/CVPR2022/papers/Tosi_RGB-Multispectral_Matching_Dataset_Learning_Methodology_Evaluation_CVPR_2022_paper.pdf
ScaleNet: A Shallow Architecture for Scale Estimation,3D From Multi-View & Sensors,"['Axel Barroso-Laguna', 'Yurun Tian']",['ICL'],https://openaccess.thecvf.com/content/CVPR2022/papers/Barroso-Laguna_ScaleNet_A_Shallow_Architecture_for_Scale_Estimation_CVPR_2022_paper.pdf
Scene Representation Transformer: Geometry-Free Novel View Synthesis Through Set-Latent Scene Representations,3D From Multi-View & Sensors,"['Mehdi S. M. Sajjadi', 'Henning Meyer']",['Google'],https://openaccess.thecvf.com/content/CVPR2022/papers/Sajjadi_Scene_Representation_Transformer_Geometry-Free_Novel_View_Synthesis_Through_Set-Latent_Scene_CVPR_2022_paper.pdf
Self-Supervised Global-Local Structure Modeling for Point Cloud Domain Adaptation With Reliable Voted Pseudo Labels,3D From Multi-View & Sensors,"['Hehe Fan', 'Xiaojun Chang']",['NUS'],https://openaccess.thecvf.com/content/CVPR2022/papers/Fan_Self-Supervised_Global-Local_Structure_Modeling_for_Point_Cloud_Domain_Adaptation_With_CVPR_2022_paper.pdf
Self-Supervised Neural Articulated Shape and Appearance Models,3D From Multi-View & Sensors,"['Fangyin Wei', 'Rohan Chabra']",['Princeton'],https://openaccess.thecvf.com/content/CVPR2022/papers/Wei_Self-Supervised_Neural_Articulated_Shape_and_Appearance_Models_CVPR_2022_paper.pdf
SelfRecon: Self Reconstruction Your Digital Avatar From Monocular Video,3D From Multi-View & Sensors,"['Boyi Jiang', 'Yang Hong']",['USTC'],https://openaccess.thecvf.com/content/CVPR2022/papers/Jiang_SelfRecon_Self_Reconstruction_Your_Digital_Avatar_From_Monocular_Video_CVPR_2022_paper.pdf
ShapeFormer: Transformer-Based Shape Completion via Sparse Representation,3D From Multi-View & Sensors,"['Xingguang Yan', 'Liqiang Lin']",['SZU'],https://openaccess.thecvf.com/content/CVPR2022/papers/Yan_ShapeFormer_Transformer-Based_Shape_Completion_via_Sparse_Representation_CVPR_2022_paper.pdf
SOMSI: Spherical Novel View Synthesis With Soft Occlusion Multi-Sphere Images,3D From Multi-View & Sensors,"['Tewodros Habtegebrial', 'Christiano Gava']",['TU'],https://openaccess.thecvf.com/content/CVPR2022/papers/Habtegebrial_SOMSI_Spherical_Novel_View_Synthesis_With_Soft_Occlusion_Multi-Sphere_Images_CVPR_2022_paper.pdf
SPAMs: Structured Implicit Parametric Models,3D From Multi-View & Sensors,"['Pablo Palafox', 'Nikolaos Sarafianos']",['TUM'],https://openaccess.thecvf.com/content/CVPR2022/papers/Palafox_SPAMs_Structured_Implicit_Parametric_Models_CVPR_2022_paper.pdf
SS3D: Sparsely-Supervised 3D Object Detection From Point Cloud,3D From Multi-View & Sensors,"['Chuandong Liu', 'Chenqiang Gao']",[' data-aff='],https://openaccess.thecvf.com/content/CVPR2022/papers/Liu_SS3D_Sparsely-Supervised_3D_Object_Detection_From_Point_Cloud_CVPR_2022_paper.pdf
Stereo Magnification With Multi-Layer Images,3D From Multi-View & Sensors,"['Taras Khakhulin', 'Denis Korzhenkov']",['Samsung'],https://openaccess.thecvf.com/content/CVPR2022/papers/Khakhulin_Stereo_Magnification_With_Multi-Layer_Images_CVPR_2022_paper.pdf
Stratified Transformer for 3D Point Cloud Segmentation,3D From Multi-View & Sensors,"['Xin Lai', 'Jianhui Liu']",['CUHK'],https://openaccess.thecvf.com/content/CVPR2022/papers/Lai_Stratified_Transformer_for_3D_Point_Cloud_Segmentation_CVPR_2022_paper.pdf
Structured Local Radiance Fields for Human Avatar Modeling,3D From Multi-View & Sensors,"['Zerong Zheng', 'Han Huang']",['THU'],https://openaccess.thecvf.com/content/CVPR2022/papers/Zheng_Structured_Local_Radiance_Fields_for_Human_Avatar_Modeling_CVPR_2022_paper.pdf
StyleMesh: Style Transfer for Indoor 3D Scene Reconstructions,3D From Multi-View & Sensors,"['Lukas H\\u00f6llein', 'Justin Johnson']",['TUM'],https://openaccess.thecvf.com/content/CVPR2022/papers/Hollein_StyleMesh_Style_Transfer_for_Indoor_3D_Scene_Reconstructions_CVPR_2022_paper.pdf
Surface Reconstruction From Point Clouds by Learning Predictive Context Priors,3D From Multi-View & Sensors,"['Baorui Ma', 'Yu-Shen Liu']",['THU'],https://openaccess.thecvf.com/content/CVPR2022/papers/Ma_Surface_Reconstruction_From_Point_Clouds_by_Learning_Predictive_Context_Priors_CVPR_2022_paper.pdf
Surface-Aligned Neural Radiance Fields for Controllable 3D Human Synthesis,3D From Multi-View & Sensors,"['Tianhan Xu', 'Yasuhiro Fujita']",['UTokyo'],https://openaccess.thecvf.com/content/CVPR2022/papers/Xu_Surface-Aligned_Neural_Radiance_Fields_for_Controllable_3D_Human_Synthesis_CVPR_2022_paper.pdf
Towards Multimodal Depth Estimation From Light Fields,3D From Multi-View & Sensors,"['Titus Leistner', 'Radek Mackowiak']",['Uni'],https://openaccess.thecvf.com/content/CVPR2022/papers/Leistner_Towards_Multimodal_Depth_Estimation_From_Light_Fields_CVPR_2022_paper.pdf
Uniform Subdivision of Omnidirectional Camera Space for Efficient Spherical Stereo Matching,3D From Multi-View & Sensors,"['Donghun Kang', 'Hyeonjoong Jang']",['KAIST'],https://openaccess.thecvf.com/content/CVPR2022/papers/Kang_Uniform_Subdivision_of_Omnidirectional_Camera_Space_for_Efficient_Spherical_Stereo_CVPR_2022_paper.pdf
Urban Radiance Fields,3D From Multi-View & Sensors,"['Konstantinos Rematas', 'Andrew Liu']",['Google'],https://openaccess.thecvf.com/content/CVPR2022/papers/Rematas_Urban_Radiance_Fields_CVPR_2022_paper.pdf
Virtual Correspondence: Humans as a Cue for Extreme-View Geometry,3D From Multi-View & Sensors,"['Wei-Chiu Ma', 'Anqi Joyce Yang']",['MIT'],https://openaccess.thecvf.com/content/CVPR2022/papers/Ma_Virtual_Correspondence_Humans_as_a_Cue_for_Extreme-View_Geometry_CVPR_2022_paper.pdf
Virtual Elastic Objects,3D From Multi-View & Sensors,"['Hsiao-yu Chen', 'Edith Tretschk']",['UT'],https://openaccess.thecvf.com/content/CVPR2022/papers/Chen_Virtual_Elastic_Objects_CVPR_2022_paper.pdf
VISTA: Boosting 3D Object Detection via Dual Cross-VIew SpaTial Attention,3D From Multi-View & Sensors,"['Shengheng Deng', 'Zhihao Liang']",['SCUT'],https://openaccess.thecvf.com/content/CVPR2022/papers/Deng_VISTA_Boosting_3D_Object_Detection_via_Dual_Cross-VIew_SpaTial_Attention_CVPR_2022_paper.pdf
Volumetric Bundle Adjustment for Online Photorealistic Scene Capture,3D From Multi-View & Sensors,"['Ronald Clark', 'Chenhang He']",['ICL'],https://openaccess.thecvf.com/content/CVPR2022/papers/Clark_Volumetric_Bundle_Adjustment_for_Online_Photorealistic_Scene_Capture_CVPR_2022_paper.pdf
Voxel Set Transformer: A Set-to-Set Approach to 3D Object Detection From Point Clouds,3D From Multi-View & Sensors,"['Chenhang He', 'Ruihuang Li']",['PolyU'],https://openaccess.thecvf.com/content/CVPR2022/papers/He_Voxel_Set_Transformer_A_Set-to-Set_Approach_to_3D_Object_Detection_CVPR_2022_paper.pdf
WarpingGAN: Warping Multiple Uniform Priors for Adversarial 3D Point Cloud Generation,3D From Multi-View & Sensors,"['Yingzhi Tang', 'Yue Qian']",['CityU'],https://openaccess.thecvf.com/content/CVPR2022/papers/Tang_WarpingGAN_Warping_Multiple_Uniform_Priors_for_Adversarial_3D_Point_Cloud_CVPR_2022_paper.pdf
X-Trans2Cap: Cross-Modal Knowledge Transfer Using Transformer for 3D Dense Captioning,3D From Multi-View & Sensors,"['Zhihao Yuan', 'Xu Yan']",['CUHK(SZ)'],https://openaccess.thecvf.com/content/CVPR2022/papers/Yuan_X-Trans2Cap_Cross-Modal_Knowledge_Transfer_Using_Transformer_for_3D_Dense_Captioning_CVPR_2022_paper.pdf
Block-NeRF: Scalable Large Scene Neural View Synthesis,"3D from Multiview & Sensors, Learning for Vision, Explainable Vision, and Privacy","['Matthew Tancik', 'Vincent Casser']",['UC'],https://openaccess.thecvf.com/content/CVPR2022/papers/Tancik_Block-NeRF_Scalable_Large_Scene_Neural_View_Synthesis_CVPR_2022_paper.pdf
Deep Spectral Methods: A Surprisingly Strong Baseline for Unsupervised Semantic Segmentation and Localization,"3D from Multiview & Sensors, Learning for Vision, Explainable Vision, and Privacy","['Luke Melas-Kyriazi', 'Christian Rupprecht']",['Oxford'],https://openaccess.thecvf.com/content/CVPR2022/papers/Melas-Kyriazi_Deep_Spectral_Methods_A_Surprisingly_Strong_Baseline_for_Unsupervised_Semantic_CVPR_2022_paper.pdf
DPGEN: Differentially Private Generative Energy-Guided Network for Natural Image Synthesis,"3D from Multiview & Sensors, Learning for Vision, Explainable Vision, and Privacy","['Jia-Wei Chen', 'Chia-Mu Yu']",['IIS'],https://openaccess.thecvf.com/content/CVPR2022/papers/Chen_DPGEN_Differentially_Private_Generative_Energy-Guided_Network_for_Natural_Image_Synthesis_CVPR_2022_paper.pdf
Explaining Deep Convolutional Neural Networks via Latent Visual-Semantic Filter Attention,"3D from Multiview & Sensors, Learning for Vision, Explainable Vision, and Privacy","['Yu Yang', 'Seungbae Kim']",['UCLA'],https://openaccess.thecvf.com/content/CVPR2022/papers/Yang_Explaining_Deep_Convolutional_Neural_Networks_via_Latent_Visual-Semantic_Filter_Attention_CVPR_2022_paper.pdf
"Extracting Triangular 3D Models, Materials, and Lighting From Images","3D from Multiview & Sensors, Learning for Vision, Explainable Vision, and Privacy","['Jacob Munkberg', 'Jon Hasselgren']",['NVIDIA'],https://openaccess.thecvf.com/content/CVPR2022/papers/Munkberg_Extracting_Triangular_3D_Models_Materials_and_Lighting_From_Images_CVPR_2022_paper.pdf
It's All in the Teacher: Zero-Shot Quantization Brought Closer to the Teacher,"3D from Multiview & Sensors, Learning for Vision, Explainable Vision, and Privacy","['Kanghyun Choi', 'Hye Yoon Lee']",['Yonsei'],https://openaccess.thecvf.com/content/CVPR2022/papers/Choi_Its_All_in_the_Teacher_Zero-Shot_Quantization_Brought_Closer_to_CVPR_2022_paper.pdf
Light Field Neural Rendering,"3D from Multiview & Sensors, Learning for Vision, Explainable Vision, and Privacy","['Mohammed Suhail', 'Carlos Esteves']",['UBC'],https://openaccess.thecvf.com/content/CVPR2022/papers/Suhail_Light_Field_Neural_Rendering_CVPR_2022_paper.pdf
Local Learning Matters: Rethinking Data Heterogeneity in Federated Learning,"3D from Multiview & Sensors, Learning for Vision, Explainable Vision, and Privacy","['Matias Mendieta', 'Taojiannan Yang']",['UCF'],https://openaccess.thecvf.com/content/CVPR2022/papers/Mendieta_Local_Learning_Matters_Rethinking_Data_Heterogeneity_in_Federated_Learning_CVPR_2022_paper.pdf
Mixed Differential Privacy in Computer Vision,"3D from Multiview & Sensors, Learning for Vision, Explainable Vision, and Privacy","['Aditya Golatkar', 'Alessandro Achille']",['AWS'],https://openaccess.thecvf.com/content/CVPR2022/papers/Golatkar_Mixed_Differential_Privacy_in_Computer_Vision_CVPR_2022_paper.pdf
NLX-GPT: A Model for Natural Language Explanations in Vision and Vision-Language Tasks,"3D from Multiview & Sensors, Learning for Vision, Explainable Vision, and Privacy","['Fawaz Sammani', 'Tanmoy Mukherjee']",['VUB'],https://openaccess.thecvf.com/content/CVPR2022/papers/Sammani_NLX-GPT_A_Model_for_Natural_Language_Explanations_in_Vision_and_CVPR_2022_paper.pdf
Parameter-Free Online Test-Time Adaptation,"3D from Multiview & Sensors, Learning for Vision, Explainable Vision, and Privacy","['Malik Boudiaf', 'Romain Mueller']",['ETS'],https://openaccess.thecvf.com/content/CVPR2022/papers/Boudiaf_Parameter-Free_Online_Test-Time_Adaptation_CVPR_2022_paper.pdf
Patch-Level Representation Learning for Self-Supervised Vision Transformers,"3D from Multiview & Sensors, Learning for Vision, Explainable Vision, and Privacy","['Sukmin Yun', 'Hankook Lee']",['KAIST'],https://openaccess.thecvf.com/content/CVPR2022/papers/Yun_Patch-Level_Representation_Learning_for_Self-Supervised_Vision_Transformers_CVPR_2022_paper.pdf
SceneSqueezer: Learning To Compress Scene for Camera Relocalization,"3D from Multiview & Sensors, Learning for Vision, Explainable Vision, and Privacy","['Luwei Yang', 'Rakesh Shrestha']",['SFU'],https://openaccess.thecvf.com/content/CVPR2022/papers/Yang_SceneSqueezer_Learning_To_Compress_Scene_for_Camera_Relocalization_CVPR_2022_paper.pdf
Stochastic Backpropagation: A Memory Efficient Strategy for Training Video Models,"3D from Multiview & Sensors, Learning for Vision, Explainable Vision, and Privacy","['Feng Cheng', 'Mingze Xu']",['UNC'],https://openaccess.thecvf.com/content/CVPR2022/papers/Cheng_Stochastic_Backpropagation_A_Memory_Efficient_Strategy_for_Training_Video_Models_CVPR_2022_paper.pdf
"Super-Fibonacci Spirals: Fast, Low-Discrepancy Sampling of SO(3)","3D from Multiview & Sensors, Learning for Vision, Explainable Vision, and Privacy","['Marc Alexa', 'Manuel Rey-Area']",['TU'],https://openaccess.thecvf.com/content/CVPR2022/papers/Alexa_Super-Fibonacci_Spirals_Fast_Low-Discrepancy_Sampling_of_SO3_CVPR_2022_paper.pdf
360MonoDepth: High-Resolution 360deg Monocular Depth Estimation,3D From Single Images,"['Manuel Rey-Area', 'Mingze Yuan']",['Bath'],https://openaccess.thecvf.com/content/CVPR2022/papers/Rey-Area_360MonoDepth_High-Resolution_360deg_Monocular_Depth_Estimation_CVPR_2022_paper.pdf
"3D Human Tongue Reconstruction From Single \""In-the-Wild\"" Images",3D From Single Images,"['Stylianos Ploumpis', 'Stylianos Moschoglou']",['ICL'],https://openaccess.thecvf.com/content/CVPR2022/papers/Ploumpis_3D_Human_Tongue_Reconstruction_From_Single_In-the-Wild_Images_CVPR_2022_paper.pdf
3D Moments From Near-Duplicate Photos,3D From Single Images,"['Qianqian Wang', 'Zhengqi Li']",['Google'],https://openaccess.thecvf.com/content/CVPR2022/papers/Wang_3D_Moments_From_Near-Duplicate_Photos_CVPR_2022_paper.pdf
3D Shape Reconstruction From 2D Images With Disentangled Attribute Flow,3D From Single Images,"['Xin Wen', 'Junsheng Zhou']",['THU'],https://openaccess.thecvf.com/content/CVPR2022/papers/Wen_3D_Shape_Reconstruction_From_2D_Images_With_Disentangled_Attribute_Flow_CVPR_2022_paper.pdf
Accurate 3D Body Shape Regression Using Metric and Semantic Attributes,3D From Single Images,"['Vasileios Choutas', 'Lea M\\u00fcller']",['MPI-IS'],https://openaccess.thecvf.com/content/CVPR2022/papers/Choutas_Accurate_3D_Body_Shape_Regression_Using_Metric_and_Semantic_Attributes_CVPR_2022_paper.pdf
ArtiBoost: Boosting Articulated 3D Hand-Object Pose Estimation via Online Exploration and Synthesis,3D From Single Images,"['Lixin Yang', 'Kailin Li']",['SJTU'],https://openaccess.thecvf.com/content/CVPR2022/papers/Yang_ArtiBoost_Boosting_Articulated_3D_Hand-Object_Pose_Estimation_via_Online_Exploration_CVPR_2022_paper.pdf
AutoRF: Learning 3D Object Radiance Fields From Single View Observations,3D From Single Images,"['Norman M\\u00fcller', 'Andrea Simonelli']",['TUM'],https://openaccess.thecvf.com/content/CVPR2022/papers/Muller_AutoRF_Learning_3D_Object_Radiance_Fields_From_Single_View_Observations_CVPR_2022_paper.pdf
BANMo: Building Animatable 3D Neural Models From Many Casual Videos,3D From Single Images,"['Gengshan Yang', 'Minh Vo']",['Meta'],https://openaccess.thecvf.com/content/CVPR2022/papers/Yang_BANMo_Building_Animatable_3D_Neural_Models_From_Many_Casual_Videos_CVPR_2022_paper.pdf
BARC: Learning To Regress 3D Dog Shape From Images by Exploiting Breed Information,3D From Single Images,"['Nadine R\\u00fcegg', 'Silvia Zuffi']",['ETHZ'],https://openaccess.thecvf.com/content/CVPR2022/papers/Ruegg_BARC_Learning_To_Regress_3D_Dog_Shape_From_Images_by_CVPR_2022_paper.pdf
CLIP-NeRF: Text-and-Image Driven Manipulation of Neural Radiance Fields,3D From Single Images,"['Can Wang', 'Menglei Chai']",['CityU'],https://openaccess.thecvf.com/content/CVPR2022/papers/Wang_CLIP-NeRF_Text-and-Image_Driven_Manipulation_of_Neural_Radiance_Fields_CVPR_2022_paper.pdf
Collaborative Learning for Hand and Object Reconstruction With Attention-Guided Graph Convolution,3D From Single Images,"['Tze Ho Elden Tse', 'Kwang In Kim']",['Birmingham'],https://openaccess.thecvf.com/content/CVPR2022/papers/Tse_Collaborative_Learning_for_Hand_and_Object_Reconstruction_With_Attention-Guided_Graph_CVPR_2022_paper.pdf
CroMo: Cross-Modal Learning for Monocular Depth Estimation,3D From Single Images,"['Yannick Verdi\\u00e9', 'Jifei Song']",['Huawei'],https://openaccess.thecvf.com/content/CVPR2022/papers/Verdie_CroMo_Cross-Modal_Learning_for_Monocular_Depth_Estimation_CVPR_2022_paper.pdf
Depth Estimation by Combining Binocular Stereo and Monocular Structured-Light,3D From Single Images,"['Yuhua Xu', 'Xiaoli Yang']",['HUT'],https://openaccess.thecvf.com/content/CVPR2022/papers/Xu_Depth_Estimation_by_Combining_Binocular_Stereo_and_Monocular_Structured-Light_CVPR_2022_paper.pdf
DGECN: A Depth-Guided Edge Convolutional Network for End-to-End 6D Pose Estimation,3D From Single Images,"['Tuo Cao', 'Fei Luo']",['WHU'],https://openaccess.thecvf.com/content/CVPR2022/papers/Cao_DGECN_A_Depth-Guided_Edge_Convolutional_Network_for_End-to-End_6D_Pose_CVPR_2022_paper.pdf
Dimension Embeddings for Monocular 3D Object Detection,3D From Single Images,"['Yunpeng Zhang', 'Wenzhao Zheng']",[' data-aff='],https://openaccess.thecvf.com/content/CVPR2022/papers/Zhang_Dimension_Embeddings_for_Monocular_3D_Object_Detection_CVPR_2022_paper.pdf
Disentangled3D: Learning a 3D Generative Model With Disentangled Geometry and Appearance From Monocular Images,3D From Single Images,"['Ayush Tewari', 'Mallikarjun B R']",['MPII'],https://openaccess.thecvf.com/content/CVPR2022/papers/Tewari_Disentangled3D_Learning_a_3D_Generative_Model_With_Disentangled_Geometry_and_CVPR_2022_paper.pdf
Diversity Matters: Fully Exploiting Depth Clues for Reliable Monocular 3D Object Detection,3D From Single Images,"['Zhuoling Li', 'Zhan Qu']",['THU'],https://openaccess.thecvf.com/content/CVPR2022/papers/Li_Diversity_Matters_Fully_Exploiting_Depth_Clues_for_Reliable_Monocular_3D_CVPR_2022_paper.pdf
Egocentric Scene Understanding via Multimodal Spatial Rectifier,3D From Single Images,"['Tien Do', 'Khiem Vuong']",['UMN'],https://openaccess.thecvf.com/content/CVPR2022/papers/Do_Egocentric_Scene_Understanding_via_Multimodal_Spatial_Rectifier_CVPR_2022_paper.pdf
EPro-PnP: Generalized End-to-End Probabilistic Perspective-N-Points for Monocular Object Pose Estimation,3D From Single Images,"['Hansheng Chen', 'Pichao Wang']",['Tongji'],https://openaccess.thecvf.com/content/CVPR2022/papers/Chen_EPro-PnP_Generalized_End-to-End_Probabilistic_Perspective-N-Points_for_Monocular_Object_Pose_Estimation_CVPR_2022_paper.pdf
Exploiting Pseudo Labels in a Self-Supervised Learning Framework for Improved Monocular Depth Estimation,3D From Single Images,"['Andra Petrovai', 'Sergiu Nedevschi']",['TUCN'],https://openaccess.thecvf.com/content/CVPR2022/papers/Petrovai_Exploiting_Pseudo_Labels_in_a_Self-Supervised_Learning_Framework_for_Improved_CVPR_2022_paper.pdf
Exploring Geometric Consistency for Monocular 3D Object Detection,3D From Single Images,"['Qing Lian', 'Botao Ye']",['HKUST'],https://openaccess.thecvf.com/content/CVPR2022/papers/Lian_Exploring_Geometric_Consistency_for_Monocular_3D_Object_Detection_CVPR_2022_paper.pdf
f-SfT: Shape-From-Template With a Physics-Based Deformation Model,3D From Single Images,"['Navami Kairanda', 'Edith Tretschk']",['MPII'],https://openaccess.thecvf.com/content/CVPR2022/papers/Kairanda_f-SfT_Shape-From-Template_With_a_Physics-Based_Deformation_Model_CVPR_2022_paper.pdf
