title,session,authors,affiliations,pdf_url
Towards Understanding Adversarial Robustness of Optical Flow Networks,Motion & Tracking,"['Simon Schrodi', 'Tonmoy Saikia']",['UoF'],https://openaccess.thecvf.com/content/CVPR2022/papers/Schrodi_Towards_Understanding_Adversarial_Robustness_of_Optical_Flow_Networks_CVPR_2022_paper.pdf
TrackFormer: Multi-Object Tracking With Transformers,Motion & Tracking,"['Tim Meinhardt', 'Alexander Kirillov']",['TUM'],https://openaccess.thecvf.com/content/CVPR2022/papers/Meinhardt_TrackFormer_Multi-Object_Tracking_With_Transformers_CVPR_2022_paper.pdf
TransforMatcher: Match-to-Match Attention for Semantic Correspondence,Motion & Tracking,"['Seungwook Kim', 'Juhong Min']",['POSTECH'],https://openaccess.thecvf.com/content/CVPR2022/papers/Kim_TransforMatcher_Match-to-Match_Attention_for_Semantic_Correspondence_CVPR_2022_paper.pdf
Transformer Tracking With Cyclic Shifting Window Attention,Motion & Tracking,"['Zikai Song', 'Junqing Yu']",['HUST'],https://openaccess.thecvf.com/content/CVPR2022/papers/Song_Transformer_Tracking_With_Cyclic_Shifting_Window_Attention_CVPR_2022_paper.pdf
Transforming Model Prediction for Tracking,Motion & Tracking,"['Christoph Mayer', 'Martin Danelljan']",['ETHZ'],https://openaccess.thecvf.com/content/CVPR2022/papers/Mayer_Transforming_Model_Prediction_for_Tracking_CVPR_2022_paper.pdf
Unified Transformer Tracker for Object Tracking,Motion & Tracking,"['Fan Ma', 'Mike Zheng Shou']",['UTS'],https://openaccess.thecvf.com/content/CVPR2022/papers/Ma_Unified_Transformer_Tracker_for_Object_Tracking_CVPR_2022_paper.pdf
Unsupervised Domain Adaptation for Nighttime Aerial Tracking,Motion & Tracking,"['Junjie Ye', 'Changhong Fu']",['Tongji'],https://openaccess.thecvf.com/content/CVPR2022/papers/Ye_Unsupervised_Domain_Adaptation_for_Nighttime_Aerial_Tracking_CVPR_2022_paper.pdf
Visible-Thermal UAV Tracking: A Large-Scale Benchmark and New Baseline,Motion & Tracking,"['Pengyu Zhang', 'Jie Zhao']",['DUT'],https://openaccess.thecvf.com/content/CVPR2022/papers/Zhang_Visible-Thermal_UAV_Tracking_A_Large-Scale_Benchmark_and_New_Baseline_CVPR_2022_paper.pdf
Whose Track Is It Anyway? Improving Robustness to Tracking Errors With Affinity-Based Trajectory Prediction,Motion & Tracking,"['Xinshuo Weng', 'Boris Ivanovic']",['CMU'],https://openaccess.thecvf.com/content/CVPR2022/papers/Weng_Whose_Track_Is_It_Anyway_Improving_Robustness_to_Tracking_Errors_CVPR_2022_paper.pdf
Audio-Visual Speech Codecs: Rethinking Audio-Visual Speech Enhancement by Re-Synthesis,"Motion, Tracking, Registration, Vision & X, and Theory","['Karren Yang', 'Dejan Markovi\\u0107']",['MIT'],https://openaccess.thecvf.com/content/CVPR2022/papers/Yang_Audio-Visual_Speech_Codecs_Rethinking_Audio-Visual_Speech_Enhancement_by_Re-Synthesis_CVPR_2022_paper.pdf
Balanced Multimodal Learning via On-the-Fly Gradient Modulation,"Motion, Tracking, Registration, Vision & X, and Theory","['Xiaokang Peng', 'Yake Wei']",['RUC'],https://openaccess.thecvf.com/content/CVPR2022/papers/Peng_Balanced_Multimodal_Learning_via_On-the-Fly_Gradient_Modulation_CVPR_2022_paper.pdf
Beyond 3D Siamese Tracking: A Motion-Centric Paradigm for 3D Single Object Tracking in Point Clouds,"Motion, Tracking, Registration, Vision & X, and Theory","['Chaoda Zheng', 'Xu Yan']",['CUHK'],https://openaccess.thecvf.com/content/CVPR2022/papers/Zheng_Beyond_3D_Siamese_Tracking_A_Motion-Centric_Paradigm_for_3D_Single_CVPR_2022_paper.pdf
Context-Aware Sequence Alignment Using 4D Skeletal Augmentation,"Motion, Tracking, Registration, Vision & X, and Theory","['Taein Kwon', 'Bugra Tekin']",['ETHZ'],https://openaccess.thecvf.com/content/CVPR2022/papers/Kwon_Context-Aware_Sequence_Alignment_Using_4D_Skeletal_Augmentation_CVPR_2022_paper.pdf
Enabling Equivariance for Arbitrary Lie Groups,"Motion, Tracking, Registration, Vision & X, and Theory","['Lachlan E. MacDonald', 'Sameera Ramasinghe']",['AIML'],https://openaccess.thecvf.com/content/CVPR2022/papers/MacDonald_Enabling_Equivariance_for_Arbitrary_Lie_Groups_CVPR_2022_paper.pdf
GMFlow: Learning Optical Flow via Global Matching,"Motion, Tracking, Registration, Vision & X, and Theory","['Haofei Xu', 'Jing Zhang']",['Monash'],https://openaccess.thecvf.com/content/CVPR2022/papers/Xu_GMFlow_Learning_Optical_Flow_via_Global_Matching_CVPR_2022_paper.pdf
GridShift: A Faster Mode-Seeking Algorithm for Image Segmentation and Object Tracking,"Motion, Tracking, Registration, Vision & X, and Theory","['Abhishek Kumar', 'Oladayo S. Ajani']",['KNU'],https://openaccess.thecvf.com/content/CVPR2022/papers/Kumar_GridShift_A_Faster_Mode-Seeking_Algorithm_for_Image_Segmentation_and_Object_CVPR_2022_paper.pdf
MeMOT: Multi-Object Tracking With Memory,"Motion, Tracking, Registration, Vision & X, and Theory","['Jiarui Cai', 'Mingze Xu']",['UW'],https://openaccess.thecvf.com/content/CVPR2022/papers/Cai_MeMOT_Multi-Object_Tracking_With_Memory_CVPR_2022_paper.pdf
Multi-Objective Diverse Human Motion Prediction With Knowledge Distillation,"Motion, Tracking, Registration, Vision & X, and Theory","['Hengbo Ma', 'Jiachen Li']",['HRI'],https://openaccess.thecvf.com/content/CVPR2022/papers/Ma_Multi-Objective_Diverse_Human_Motion_Prediction_With_Knowledge_Distillation_CVPR_2022_paper.pdf
RAMA: A Rapid Multicut Algorithm on GPU,"Motion, Tracking, Registration, Vision & X, and Theory","['Ahmed Abbas', 'Paul Swoboda']",['MPII'],https://openaccess.thecvf.com/content/CVPR2022/papers/Abbas_RAMA_A_Rapid_Multicut_Algorithm_on_GPU_CVPR_2022_paper.pdf
RCP: Recurrent Closest Point for Point Cloud,"Motion, Tracking, Registration, Vision & X, and Theory","['Xiaodong Gu', 'Chengzhou Tang']",['Alibaba'],https://openaccess.thecvf.com/content/CVPR2022/papers/Gu_RCP_Recurrent_Closest_Point_for_Point_Cloud_CVPR_2022_paper.pdf
Self-Supervised Material and Texture Representation Learning for Remote Sensing Tasks,"Motion, Tracking, Registration, Vision & X, and Theory","['Peri Akiva', 'Matthew Purri']",['Rutgers'],https://openaccess.thecvf.com/content/CVPR2022/papers/Akiva_Self-Supervised_Material_and_Texture_Representation_Learning_for_Remote_Sensing_Tasks_CVPR_2022_paper.pdf
SNUG: Self-Supervised Neural Dynamic Garments,"Motion, Tracking, Registration, Vision & X, and Theory","['Igor Santesteban', 'Miguel A. Otaduy']",['URJC'],https://openaccess.thecvf.com/content/CVPR2022/papers/Santesteban_SNUG_Self-Supervised_Neural_Dynamic_Garments_CVPR_2022_paper.pdf
Unsupervised Learning of Accurate Siamese Tracking,"Motion, Tracking, Registration, Vision & X, and Theory","['Qiuhong Shen', 'Lei Qiao']",['HIT'],https://openaccess.thecvf.com/content/CVPR2022/papers/Shen_Unsupervised_Learning_of_Accurate_Siamese_Tracking_CVPR_2022_paper.pdf
Weakly-Supervised Action Transition Learning for Stochastic Human Motion Prediction,"Motion, Tracking, Registration, Vision & X, and Theory","['Wei Mao', 'Miaomiao Liu']",['ANU'],https://openaccess.thecvf.com/content/CVPR2022/papers/Mao_Weakly-Supervised_Action_Transition_Learning_for_Stochastic_Human_Motion_Prediction_CVPR_2022_paper.pdf
3D-VField: Adversarial Augmentation of Point Clouds for Domain Generalization in 3D Object Detection,Navigation & Autonomous Driving,"['Alexander Lehner', 'Stefano Gasperini']",['TUM'],https://openaccess.thecvf.com/content/CVPR2022/papers/Lehner_3D-VField_Adversarial_Augmentation_of_Point_Clouds_for_Domain_Generalization_in_CVPR_2022_paper.pdf
A Versatile Multi-View Framework for LiDAR-Based 3D Object Detection With Guidance From Panoptic Segmentation,Navigation & Autonomous Driving,"['Hamidreza Fazlali', 'Yixuan Xu']",['HNAL'],https://openaccess.thecvf.com/content/CVPR2022/papers/Fazlali_A_Versatile_Multi-View_Framework_for_LiDAR-Based_3D_Object_Detection_With_CVPR_2022_paper.pdf
BE-STI: Spatial-Temporal Integrated Network for Class-Agnostic Motion Prediction With Bidirectional Enhancement,Navigation & Autonomous Driving,"['Yunlong Wang', 'Hongyu Pan']",['Alibaba'],https://openaccess.thecvf.com/content/CVPR2022/papers/Wang_BE-STI_Spatial-Temporal_Integrated_Network_for_Class-Agnostic_Motion_Prediction_With_Bidirectional_CVPR_2022_paper.pdf
Coopernaut: End-to-End Driving With Cooperative Perception for Networked Vehicles,Navigation & Autonomous Driving,"['Jiaxun Cui', 'Hang Qiu']",['UT'],https://openaccess.thecvf.com/content/CVPR2022/papers/Cui_Coopernaut_End-to-End_Driving_With_Cooperative_Perception_for_Networked_Vehicles_CVPR_2022_paper.pdf
Coupling Vision and Proprioception for Navigation of Legged Robots,Navigation & Autonomous Driving,"['Zipeng Fu', 'Ashish Kumar']",['CMU'],https://openaccess.thecvf.com/content/CVPR2022/papers/Fu_Coupling_Vision_and_Proprioception_for_Navigation_of_Legged_Robots_CVPR_2022_paper.pdf
CrossLoc: Scalable Aerial Localization Assisted by Multimodal Synthetic Data,Navigation & Autonomous Driving,"['Qi Yan', 'Jianhao Zheng']",['EPFL'],https://openaccess.thecvf.com/content/CVPR2022/papers/Yan_CrossLoc_Scalable_Aerial_Localization_Assisted_by_Multimodal_Synthetic_Data_CVPR_2022_paper.pdf
DeepFusion: Lidar-Camera Deep Fusion for Multi-Modal 3D Object Detection,Navigation & Autonomous Driving,"['Yingwei Li', 'Adams Wei Yu']",['JHU'],https://openaccess.thecvf.com/content/CVPR2022/papers/Li_DeepFusion_Lidar-Camera_Deep_Fusion_for_Multi-Modal_3D_Object_Detection_CVPR_2022_paper.pdf
Efficient Large-Scale Localization by Global Instance Recognition,Navigation & Autonomous Driving,"['Fei Xue', 'Ignas Budvytis']",['Cambridge'],https://openaccess.thecvf.com/content/CVPR2022/papers/Xue_Efficient_Large-Scale_Localization_by_Global_Instance_Recognition_CVPR_2022_paper.pdf
Eigenlanes: Data-Driven Lane Descriptors for Structurally Diverse Lanes,Navigation & Autonomous Driving,"['Dongkwon Jin', 'Wonhui Park']",['KU'],https://openaccess.thecvf.com/content/CVPR2022/papers/Jin_Eigenlanes_Data-Driven_Lane_Descriptors_for_Structurally_Diverse_Lanes_CVPR_2022_paper.pdf
Exploiting Temporal Relations on Radar Perception for Autonomous Driving,Navigation & Autonomous Driving,"['Peizhao Li', 'Pu Wang']",['Brandeis'],https://openaccess.thecvf.com/content/CVPR2022/papers/Li_Exploiting_Temporal_Relations_on_Radar_Perception_for_Autonomous_Driving_CVPR_2022_paper.pdf
Forecasting From LiDAR via Future Object Detection,Navigation & Autonomous Driving,"['Neehar Peri', 'Jonathon Luiten']",['CMU'],https://openaccess.thecvf.com/content/CVPR2022/papers/Peri_Forecasting_From_LiDAR_via_Future_Object_Detection_CVPR_2022_paper.pdf
Generating Useful Accident-Prone Driving Scenarios via a Learned Traffic Prior,Navigation & Autonomous Driving,"['Davis Rempe', 'Jonah Philion']",['Stanford'],https://openaccess.thecvf.com/content/CVPR2022/papers/Rempe_Generating_Useful_Accident-Prone_Driving_Scenarios_via_a_Learned_Traffic_Prior_CVPR_2022_paper.pdf
Is Mapping Necessary for Realistic PointGoal Navigation?,Navigation & Autonomous Driving,"['Ruslan Partsey', 'Erik Wijmans']",['UCU'],https://openaccess.thecvf.com/content/CVPR2022/papers/Partsey_Is_Mapping_Necessary_for_Realistic_PointGoal_Navigation_CVPR_2022_paper.pdf
Learning From All Vehicles,Navigation & Autonomous Driving,"['Dian Chen', 'Philipp Kr\\u00e4henb\\u00fchl']",['UT'],https://openaccess.thecvf.com/content/CVPR2022/papers/Chen_Learning_From_All_Vehicles_CVPR_2022_paper.pdf
LIFT: Learning 4D LiDAR Image Fusion Transformer for 3D Object Detection,Navigation & Autonomous Driving,"['Yihan Zeng', 'Da Zhang']",['SJTU'],https://openaccess.thecvf.com/content/CVPR2022/papers/Zeng_LIFT_Learning_4D_LiDAR_Image_Fusion_Transformer_for_3D_Object_CVPR_2022_paper.pdf
LTP: Lane-Based Trajectory Prediction for Autonomous Driving,Navigation & Autonomous Driving,"['Jingke Wang', 'Tengju Ye']",['Alibaba'],https://openaccess.thecvf.com/content/CVPR2022/papers/Wang_LTP_Lane-Based_Trajectory_Prediction_for_Autonomous_Driving_CVPR_2022_paper.pdf
ONCE-3DLanes: Building Monocular 3D Lane Detection,Navigation & Autonomous Driving,"['Fan Yan', 'Ming Nie']",['Fudan'],https://openaccess.thecvf.com/content/CVPR2022/papers/Yan_ONCE-3DLanes_Building_Monocular_3D_Lane_Detection_CVPR_2022_paper.pdf
Privacy Preserving Partial Localization,Navigation & Autonomous Driving,"['Marcel Geppert', 'Viktor Larsson']",['ETHZ'],https://openaccess.thecvf.com/content/CVPR2022/papers/Geppert_Privacy_Preserving_Partial_Localization_CVPR_2022_paper.pdf
Pyramid Architecture for Multi-Scale Processing in Point Cloud Segmentation,Navigation & Autonomous Driving,"['Dong Nie', 'Rui Lan']",['Alibaba'],https://openaccess.thecvf.com/content/CVPR2022/papers/Nie_Pyramid_Architecture_for_Multi-Scale_Processing_in_Point_Cloud_Segmentation_CVPR_2022_paper.pdf
Rethinking Efficient Lane Detection via Curve Modeling,Navigation & Autonomous Driving,"['Zhengyang Feng', 'Shaohua Guo']",['SJTU'],https://openaccess.thecvf.com/content/CVPR2022/papers/Feng_Rethinking_Efficient_Lane_Detection_via_Curve_Modeling_CVPR_2022_paper.pdf
RIDDLE: Lidar Data Compression With Range Image Deep Delta Encoding,Navigation & Autonomous Driving,"['Xuanyu Zhou', 'Charles R. Qi']",['Waymo'],https://openaccess.thecvf.com/content/CVPR2022/papers/Zhou_RIDDLE_Lidar_Data_Compression_With_Range_Image_Deep_Delta_Encoding_CVPR_2022_paper.pdf
"ScePT: Scene-Consistent, Policy-Based Trajectory Predictions for Planning",Navigation & Autonomous Driving,"['Yuxiao Chen', 'Boris Ivanovic']",['NVIDIA'],https://openaccess.thecvf.com/content/CVPR2022/papers/Chen_ScePT_Scene-Consistent_Policy-Based_Trajectory_Predictions_for_Planning_CVPR_2022_paper.pdf
SelfD: Self-Learning Large-Scale Driving Policies From the Web,Navigation & Autonomous Driving,"['Jimuyang Zhang', 'Ruizhao Zhu']",['BU'],https://openaccess.thecvf.com/content/CVPR2022/papers/Zhang_SelfD_Self-Learning_Large-Scale_Driving_Policies_From_the_Web_CVPR_2022_paper.pdf
Stochastic Trajectory Prediction via Motion Indeterminacy Diffusion,Navigation & Autonomous Driving,"['Tianpei Gu', 'Guangyi Chen']",['UCLA'],https://openaccess.thecvf.com/content/CVPR2022/papers/Gu_Stochastic_Trajectory_Prediction_via_Motion_Indeterminacy_Diffusion_CVPR_2022_paper.pdf
Symmetry-Aware Neural Architecture for Embodied Visual Exploration,Navigation & Autonomous Driving,"['Shuang Liu', 'Takayuki Okatani']",['RIKEN'],https://openaccess.thecvf.com/content/CVPR2022/papers/Liu_Symmetry-Aware_Neural_Architecture_for_Embodied_Visual_Exploration_CVPR_2022_paper.pdf
Topology Preserving Local Road Network Estimation From Single Onboard Camera Image,Navigation & Autonomous Driving,"['Yigit Baran Can', 'Alexander Liniger']",['ETHZ'],https://openaccess.thecvf.com/content/CVPR2022/papers/Can_Topology_Preserving_Local_Road_Network_Estimation_From_Single_Onboard_Camera_CVPR_2022_paper.pdf
Towards Driving-Oriented Metric for Lane Detection Models,Navigation & Autonomous Driving,"['Takami Sato', 'Qi Alfred Chen']",['UCI'],https://openaccess.thecvf.com/content/CVPR2022/papers/Sato_Towards_Driving-Oriented_Metric_for_Lane_Detection_Models_CVPR_2022_paper.pdf
Towards Real-World Navigation With Deep Differentiable Planners,Navigation & Autonomous Driving,"['Shu Ishida', 'Jo\\u00e3o F. Henriques']",['VGG'],https://openaccess.thecvf.com/content/CVPR2022/papers/Ishida_Towards_Real-World_Navigation_With_Deep_Differentiable_Planners_CVPR_2022_paper.pdf
Towards Robust and Adaptive Motion Forecasting: A Causal Representation Perspective,Navigation & Autonomous Driving,"['Yuejiang Liu', 'Riccardo Cadei']",['EPFL'],https://openaccess.thecvf.com/content/CVPR2022/papers/Liu_Towards_Robust_and_Adaptive_Motion_Forecasting_A_Causal_Representation_Perspective_CVPR_2022_paper.pdf
"Vehicle Trajectory Prediction Works, but Not Everywhere",Navigation & Autonomous Driving,"['Mohammadhossein Bahari', 'Saeed Saadatnejad']",['EPFL'],https://openaccess.thecvf.com/content/CVPR2022/papers/Bahari_Vehicle_Trajectory_Prediction_Works_but_Not_Everywhere_CVPR_2022_paper.pdf
A Hybrid Quantum-Classical Algorithm for Robust Fitting,Optimization Methods,"['Anh-Dzung Doan', 'Michele Sasdelli']",['Adelaide'],https://openaccess.thecvf.com/content/CVPR2022/papers/Doan_A_Hybrid_Quantum-Classical_Algorithm_for_Robust_Fitting_CVPR_2022_paper.pdf
A Scalable Combinatorial Solver for Elastic Geometrically Consistent 3D Shape Matching,Optimization Methods,"['Paul Roetzer', 'Paul Swoboda']",['TUM'],https://openaccess.thecvf.com/content/CVPR2022/papers/Roetzer_A_Scalable_Combinatorial_Solver_for_Elastic_Geometrically_Consistent_3D_Shape_CVPR_2022_paper.pdf
A Unified Framework for Implicit Sinkhorn Differentiation,Optimization Methods,"['Marvin Eisenberger', 'Aysim Toker']",['TUM'],https://openaccess.thecvf.com/content/CVPR2022/papers/Eisenberger_A_Unified_Framework_for_Implicit_Sinkhorn_Differentiation_CVPR_2022_paper.pdf
AdaSTE: An Adaptive Straight-Through Estimator To Train Binary Neural Networks,Optimization Methods,"['Huu Le', 'Rasmus Kj\\u00e6r H\\u00f8ier']",['Chalmers'],https://openaccess.thecvf.com/content/CVPR2022/papers/Le_AdaSTE_An_Adaptive_Straight-Through_Estimator_To_Train_Binary_Neural_Networks_CVPR_2022_paper.pdf
AME: Attention and Memory Enhancement in Hyper-Parameter Optimization,Optimization Methods,"['Nuo Xu', 'Jianlong Chang']",['CAS'],https://openaccess.thecvf.com/content/CVPR2022/papers/Xu_AME_Attention_and_Memory_Enhancement_in_Hyper-Parameter_Optimization_CVPR_2022_paper.pdf
An Iterative Quantum Approach for Transformation Estimation From Point Sets,Optimization Methods,"['Natacha Kuete Meli', 'Florian Mannel']",[' data-aff='],https://openaccess.thecvf.com/content/CVPR2022/papers/Meli_An_Iterative_Quantum_Approach_for_Transformation_Estimation_From_Point_Sets_CVPR_2022_paper.pdf
Computing Wasserstein-p Distance Between Images With Linear Cost,Optimization Methods,"['Yidong Chen', 'Chen Li']",['CAS'],https://openaccess.thecvf.com/content/CVPR2022/papers/Chen_Computing_Wasserstein-p_Distance_Between_Images_With_Linear_Cost_CVPR_2022_paper.pdf
Data-Free Network Compression via Parametric Non-Uniform Mixed Precision Quantization,Optimization Methods,"['Vladimir Chikin', 'Mikhail Antiukh']",['Huawei'],https://openaccess.thecvf.com/content/CVPR2022/papers/Chikin_Data-Free_Network_Compression_via_Parametric_Non-Uniform_Mixed_Precision_Quantization_CVPR_2022_paper.pdf
Efficient Maximal Coding Rate Reduction by Variational Forms,Optimization Methods,"['Christina Baek', 'Ziyang Wu']",['CMU'],https://openaccess.thecvf.com/content/CVPR2022/papers/Baek_Efficient_Maximal_Coding_Rate_Reduction_by_Variational_Forms_CVPR_2022_paper.pdf
FastDOG: Fast Discrete Optimization on GPU,Optimization Methods,"['Ahmed Abbas', 'Paul Swoboda']",['MPII'],https://openaccess.thecvf.com/content/CVPR2022/papers/Abbas_FastDOG_Fast_Discrete_Optimization_on_GPU_CVPR_2022_paper.pdf
Training Quantised Neural Networks With STE Variants: The Additive Noise Annealing Algorithm,Optimization Methods,"['Matteo Spallanzani', 'Gian Paolo Leonardi']",['ETH'],https://openaccess.thecvf.com/content/CVPR2022/papers/Spallanzani_Training_Quantised_Neural_Networks_With_STE_Variants_The_Additive_Noise_CVPR_2022_paper.pdf
HyperTransformer: A Textural and Spectral Feature Fusion Transformer for Pansharpening,Photogrammetry and Remote Sensing,"['Wele Gedara Chaminda Bandara', 'Vishal M. Patel']",['JHU'],https://openaccess.thecvf.com/content/CVPR2022/papers/Bandara_HyperTransformer_A_Textural_and_Spectral_Feature_Fusion_Transformer_for_Pansharpening_CVPR_2022_paper.pdf
Memory-Augmented Deep Conditional Unfolding Network for Pan-Sharpening,Photogrammetry and Remote Sensing,"['Gang Yang', 'Man Zhou']",['USTC'],https://openaccess.thecvf.com/content/CVPR2022/papers/Yang_Memory-Augmented_Deep_Conditional_Unfolding_Network_for_Pan-Sharpening_CVPR_2022_paper.pdf
Mutual Information-Driven Pan-Sharpening,Photogrammetry and Remote Sensing,"['Man Zhou', 'Keyu Yan']",[' data-aff='],https://openaccess.thecvf.com/content/CVPR2022/papers/Zhou_Mutual_Information-Driven_Pan-Sharpening_CVPR_2022_paper.pdf
Oriented RepPoints for Aerial Object Detection,Photogrammetry and Remote Sensing,"['Wentong Li', 'Yijie Chen']",['ZJU'],https://openaccess.thecvf.com/content/CVPR2022/papers/Li_Oriented_RepPoints_for_Aerial_Object_Detection_CVPR_2022_paper.pdf
PolyWorld: Polygonal Building Extraction With Graph Neural Networks in Satellite Images,Photogrammetry and Remote Sensing,"['Stefano Zorzi', 'Shabab Bazrafkan']",['TUGraz'],https://openaccess.thecvf.com/content/CVPR2022/papers/Zorzi_PolyWorld_Polygonal_Building_Extraction_With_Graph_Neural_Networks_in_Satellite_CVPR_2022_paper.pdf
Revisiting Near\/Remote Sensing With Geospatial Attention,Photogrammetry and Remote Sensing,"['Scott Workman', 'M. Usman Rafique']",[' data-aff='],https://openaccess.thecvf.com/content/CVPR2022/papers/Workman_Revisiting_NearRemote_Sensing_With_Geospatial_Attention_CVPR_2022_paper.pdf
Self-Supervised Super-Resolution for Multi-Exposure Push-Frame Satellites,Photogrammetry and Remote Sensing,"['Ngoc Long Nguyen', 'J\\u00e9r\\u00e9my Anger']",['UPS'],https://openaccess.thecvf.com/content/CVPR2022/papers/Nguyen_Self-Supervised_Super-Resolution_for_Multi-Exposure_Push-Frame_Satellites_CVPR_2022_paper.pdf
Sparse and Complete Latent Organization for Geospatial Semantic Segmentation,Photogrammetry and Remote Sensing,"['Fengyu Yang', 'Chenyang Ma']",['UM'],https://openaccess.thecvf.com/content/CVPR2022/papers/Yang_Sparse_and_Complete_Latent_Organization_for_Geospatial_Semantic_Segmentation_CVPR_2022_paper.pdf
The Probabilistic Normal Epipolar Constraint for Frame-to-Frame Rotation Optimization Under Uncertain Feature Positions,Photogrammetry and Remote Sensing,"['Dominik Muhle', 'Lukas Koestler']",['TUM'],https://openaccess.thecvf.com/content/CVPR2022/papers/Muhle_The_Probabilistic_Normal_Epipolar_Constraint_for_Frame-to-Frame_Rotation_Optimization_Under_CVPR_2022_paper.pdf
Using 3D Topological Connectivity for Ghost Particle Reduction in Flow Reconstruction,Photogrammetry and Remote Sensing,"['Christina Tsalicoglou', 'Thomas R\\u00f6sgen']",['ETHZ'],https://openaccess.thecvf.com/content/CVPR2022/papers/Tsalicoglou_Using_3D_Topological_Connectivity_for_Ghost_Particle_Reduction_in_Flow_CVPR_2022_paper.pdf
Deep Depth From Focus With Differential Focus Volume,Physics-Based Vision and Shape-From-X,"['Fengting Yang', 'Xiaolei Huang']",['PSU'],https://openaccess.thecvf.com/content/CVPR2022/papers/Yang_Deep_Depth_From_Focus_With_Differential_Focus_Volume_CVPR_2022_paper.pdf
DiLiGenT102: A Photometric Stereo Benchmark Dataset With Controlled Shape and Material Variation,Physics-Based Vision and Shape-From-X,"['Jieji Ren', 'Feishi Wang']",['SJTU'],https://openaccess.thecvf.com/content/CVPR2022/papers/Ren_DiLiGenT102_A_Photometric_Stereo_Benchmark_Dataset_With_Controlled_Shape_and_CVPR_2022_paper.pdf
Estimating Fine-Grained Noise Model via Contrastive Learning,Physics-Based Vision and Shape-From-X,"['Yunhao Zou', 'Ying Fu']",['BIT'],https://openaccess.thecvf.com/content/CVPR2022/papers/Zou_Estimating_Fine-Grained_Noise_Model_via_Contrastive_Learning_CVPR_2022_paper.pdf
Fast Light-Weight Near-Field Photometric Stereo,Physics-Based Vision and Shape-From-X,"['Daniel Lichy', 'Soumyadip Sengupta']",['UMD'],https://openaccess.thecvf.com/content/CVPR2022/papers/Lichy_Fast_Light-Weight_Near-Field_Photometric_Stereo_CVPR_2022_paper.pdf
Glass Segmentation Using Intensity and Spectral Polarization Cues,Physics-Based Vision and Shape-From-X,"['Haiyang Mei', 'Bo Dong']",['DUT'],https://openaccess.thecvf.com/content/CVPR2022/papers/Mei_Glass_Segmentation_Using_Intensity_and_Spectral_Polarization_Cues_CVPR_2022_paper.pdf
MNSRNet: Multimodal Transformer Network for 3D Surface Super-Resolution,Physics-Based Vision and Shape-From-X,"['Wuyuan Xie', 'Tengcong Huang']",['SZU'],https://openaccess.thecvf.com/content/CVPR2022/papers/Xie_MNSRNet_Multimodal_Transformer_Network_for_3D_Surface_Super-Resolution_CVPR_2022_paper.pdf
NAN: Noise-Aware NeRFs for Burst-Denoising,Physics-Based Vision and Shape-From-X,"['Naama Pearl', 'Tali Treibitz']",['Haifa'],https://openaccess.thecvf.com/content/CVPR2022/papers/Pearl_NAN_Noise-Aware_NeRFs_for_Burst-Denoising_CVPR_2022_paper.pdf
Optimal LED Spectral Multiplexing for NIR2RGB Translation,Physics-Based Vision and Shape-From-X,"['Lei Liu', 'Yuze Chen']",['SJTU'],https://openaccess.thecvf.com/content/CVPR2022/papers/Liu_Optimal_LED_Spectral_Multiplexing_for_NIR2RGB_Translation_CVPR_2022_paper.pdf
PhyIR: Physics-Based Inverse Rendering for Panoramic Indoor Images,Physics-Based Vision and Shape-From-X,"['Zhen Li', 'Lingli Wang']",[' data-aff='],https://openaccess.thecvf.com/content/CVPR2022/papers/Li_PhyIR_Physics-Based_Inverse_Rendering_for_Panoramic_Indoor_Images_CVPR_2022_paper.pdf
Real-Time Hyperspectral Imaging in Hardware via Trained Metasurface Encoders,Physics-Based Vision and Shape-From-X,"['Maksim Makarenko', 'Arturo Burguete-Lopez']",['KAUST'],https://openaccess.thecvf.com/content/CVPR2022/papers/Makarenko_Real-Time_Hyperspectral_Imaging_in_Hardware_via_Trained_Metasurface_Encoders_CVPR_2022_paper.pdf
Shape From Polarization for Complex Scenes in the Wild,Physics-Based Vision and Shape-From-X,"['Chenyang Lei', 'Chenyang Qi']",['HKUST'],https://openaccess.thecvf.com/content/CVPR2022/papers/Lei_Shape_From_Polarization_for_Complex_Scenes_in_the_Wild_CVPR_2022_paper.pdf
Shape From Thermal Radiation: Passive Ranging Using Multi-Spectral LWIR Measurements,Physics-Based Vision and Shape-From-X,"['Yasuto Nagase', 'Takahiro Kushida']",['NAIST'],https://openaccess.thecvf.com/content/CVPR2022/papers/Nagase_Shape_From_Thermal_Radiation_Passive_Ranging_Using_Multi-Spectral_LWIR_Measurements_CVPR_2022_paper.pdf
Uncertainty-Aware Deep Multi-View Photometric Stereo,Physics-Based Vision and Shape-From-X,"['Berk Kaya', 'Suryansh Kumar']",['ETHZ'],https://openaccess.thecvf.com/content/CVPR2022/papers/Kaya_Uncertainty-Aware_Deep_Multi-View_Photometric_Stereo_CVPR_2022_paper.pdf
