title,session,authors,affiliations,pdf_url
FAM: Visual Explanations for the Feature Representations From Deep Convolutional Networks,Explainable Computer Vision,"['Yuxi Wu', 'Changhuai Chen']",['Hikvision'],https://openaccess.thecvf.com/content/CVPR2022/papers/Wu_FAM_Visual_Explanations_for_the_Feature_Representations_From_Deep_Convolutional_CVPR_2022_paper.pdf
HINT: Hierarchical Neuron Concept Explainer,Explainable Computer Vision,"['Andong Wang', 'Wei-Ning Lee']",['HKU'],https://openaccess.thecvf.com/content/CVPR2022/papers/Wang_HINT_Hierarchical_Neuron_Concept_Explainer_CVPR_2022_paper.pdf
Interactive Disentanglement: Learning Concepts by Interacting With Their Prototype Representations,Explainable Computer Vision,"['Wolfgang Stammer', 'Marius Memmel']",['TU'],https://openaccess.thecvf.com/content/CVPR2022/papers/Stammer_Interactive_Disentanglement_Learning_Concepts_by_Interacting_With_Their_Prototype_Representations_CVPR_2022_paper.pdf
"Proto2Proto: Can You Recognize the Car, the Way I Do?",Explainable Computer Vision,"['Monish Keswani', 'Sriranjani Ramakrishnan']",['IIT'],https://openaccess.thecvf.com/content/CVPR2022/papers/Keswani_Proto2Proto_Can_You_Recognize_the_Car_the_Way_I_Do_CVPR_2022_paper.pdf
The Flag Median and FlagIRLS,Explainable Computer Vision,"['Nathan Mankovich', 'Emily J. King']",['CSU'],https://openaccess.thecvf.com/content/CVPR2022/papers/Mankovich_The_Flag_Median_and_FlagIRLS_CVPR_2022_paper.pdf
Towards Better Understanding Attribution Methods,Explainable Computer Vision,"['Sukrut Rao', 'Moritz B\\u00f6hle']",['MPII'],https://openaccess.thecvf.com/content/CVPR2022/papers/Rao_Towards_Better_Understanding_Attribution_Methods_CVPR_2022_paper.pdf
What Do Navigation Agents Learn About Their Environment?,Explainable Computer Vision,"['Kshitij Dwivedi', 'Gemma Roig']",['GU'],https://openaccess.thecvf.com/content/CVPR2022/papers/Dwivedi_What_Do_Navigation_Agents_Learn_About_Their_Environment_CVPR_2022_paper.pdf
An Efficient Training Approach for Very Large Scale Face Recognition,Face & Gestures,"['Kai Wang', 'Shuo Wang']",['NUS'],https://openaccess.thecvf.com/content/CVPR2022/papers/Wang_An_Efficient_Training_Approach_for_Very_Large_Scale_Face_Recognition_CVPR_2022_paper.pdf
Decoupled Multi-Task Learning With Cyclical Self-Regulation for Face Parsing,Face & Gestures,"['Qingping Zheng', 'Jiankang Deng']",['NWPU'],https://openaccess.thecvf.com/content/CVPR2022/papers/Zheng_Decoupled_Multi-Task_Learning_With_Cyclical_Self-Regulation_for_Face_Parsing_CVPR_2022_paper.pdf
Domain Generalization via Shuffled Style Assembly for Face Anti-Spoofing,Face & Gestures,"['Zhuo Wang', 'Zezheng Wang']",['BUPT'],https://openaccess.thecvf.com/content/CVPR2022/papers/Wang_Domain_Generalization_via_Shuffled_Style_Assembly_for_Face_Anti-Spoofing_CVPR_2022_paper.pdf
End-to-End Reconstruction-Classification Learning for Face Forgery Detection,Face & Gestures,"['Junyi Cao', 'Chao Ma']",['SJTU'],https://openaccess.thecvf.com/content/CVPR2022/papers/Cao_End-to-End_Reconstruction-Classification_Learning_for_Face_Forgery_Detection_CVPR_2022_paper.pdf
Enhancing Face Recognition With Self-Supervised 3D Reconstruction,Face & Gestures,"['Mingjie He', 'Jie Zhang']",['CAS'],https://openaccess.thecvf.com/content/CVPR2022/papers/He_Enhancing_Face_Recognition_With_Self-Supervised_3D_Reconstruction_CVPR_2022_paper.pdf
Exploring Frequency Adversarial Attacks for Face Forgery Detection,Face & Gestures,"['Shuai Jia', 'Chao Ma']",['SJTU'],https://openaccess.thecvf.com/content/CVPR2022/papers/Jia_Exploring_Frequency_Adversarial_Attacks_for_Face_Forgery_Detection_CVPR_2022_paper.pdf
Face Relighting With Geometrically Consistent Shadows,Face & Gestures,"['Andrew Hou', 'Michel Sarkis']",['MSU'],https://openaccess.thecvf.com/content/CVPR2022/papers/Hou_Face_Relighting_With_Geometrically_Consistent_Shadows_CVPR_2022_paper.pdf
GazeOnce: Real-Time Multi-Person Gaze Estimation,Face & Gestures,"['Mingfang Zhang', 'Yunfei Liu']",['PCL'],https://openaccess.thecvf.com/content/CVPR2022/papers/Zhang_GazeOnce_Real-Time_Multi-Person_Gaze_Estimation_CVPR_2022_paper.pdf
Generalizing Gaze Estimation With Rotation Consistency,Face & Gestures,"['Yiwei Bao', 'Yunfei Liu']",['Beihang'],https://openaccess.thecvf.com/content/CVPR2022/papers/Bao_Generalizing_Gaze_Estimation_With_Rotation_Consistency_CVPR_2022_paper.pdf
HairMapper: Removing Hair From Portraits Using GANs,Face & Gestures,"['Yiqian Wu', 'Yong-Liang Yang']",['ZJU'],https://openaccess.thecvf.com/content/CVPR2022/papers/Wu_HairMapper_Removing_Hair_From_Portraits_Using_GANs_CVPR_2022_paper.pdf
HP-Capsule: Unsupervised Face Part Discovery by Hierarchical Parsing Capsule Network,Face & Gestures,"['Chang Yu', 'Xiangyu Zhu']",['CAS'],https://openaccess.thecvf.com/content/CVPR2022/papers/Yu_HP-Capsule_Unsupervised_Face_Part_Discovery_by_Hierarchical_Parsing_Capsule_Network_CVPR_2022_paper.pdf
Killing Two Birds With One Stone: Efficient and Robust Training of Face Recognition CNNs by Partial FC,Face & Gestures,"['Xiang An', 'Jiankang Deng']",['DeepGlint'],https://openaccess.thecvf.com/content/CVPR2022/papers/An_Killing_Two_Birds_With_One_Stone_Efficient_and_Robust_Training_CVPR_2022_paper.pdf
Learning To Learn Across Diverse Data Biases in Deep Face Recognition,Face & Gestures,"['Chang Liu', 'Xiang Yu']",['NEU'],https://openaccess.thecvf.com/content/CVPR2022/papers/Liu_Learning_To_Learn_Across_Diverse_Data_Biases_in_Deep_Face_CVPR_2022_paper.pdf
Learning To Restore 3D Face From In-the-Wild Degraded Images,Face & Gestures,"['Zhenyu Zhang', 'Yanhao Ge']",['Tencent'],https://openaccess.thecvf.com/content/CVPR2022/papers/Zhang_Learning_To_Restore_3D_Face_From_In-the-Wild_Degraded_Images_CVPR_2022_paper.pdf
MogFace: Towards a Deeper Appreciation on Face Detection,Face & Gestures,"['Yang Liu', 'Fei Wang']",['Alibaba'],https://openaccess.thecvf.com/content/CVPR2022/papers/Liu_MogFace_Towards_a_Deeper_Appreciation_on_Face_Detection_CVPR_2022_paper.pdf
PhysFormer: Facial Video-Based Physiological Measurement With Temporal Difference Transformer,Face & Gestures,"['Zitong Yu', 'Yuming Shen']",[' data-aff='],https://openaccess.thecvf.com/content/CVPR2022/papers/Yu_PhysFormer_Facial_Video-Based_Physiological_Measurement_With_Temporal_Difference_Transformer_CVPR_2022_paper.pdf
Privacy-Preserving Online AutoML for Domain-Specific Face Detection,Face & Gestures,"['Chenqian Yan', 'Yuge Zhang']",['MSR'],https://openaccess.thecvf.com/content/CVPR2022/papers/Yan_Privacy-Preserving_Online_AutoML_for_Domain-Specific_Face_Detection_CVPR_2022_paper.pdf
Simulated Adversarial Testing of Face Recognition Models,Face & Gestures,"['Nataniel Ruiz', 'Adam Kortylewski']",['BU'],https://openaccess.thecvf.com/content/CVPR2022/papers/Ruiz_Simulated_Adversarial_Testing_of_Face_Recognition_Models_CVPR_2022_paper.pdf
Sparse Local Patch Transformer for Robust Face Alignment and Landmarks Inherent Relation Learning,Face & Gestures,"['Jiahao Xia', 'Weiwei Qu']",['UTS'],https://openaccess.thecvf.com/content/CVPR2022/papers/Xia_Sparse_Local_Patch_Transformer_for_Robust_Face_Alignment_and_Landmarks_CVPR_2022_paper.pdf
Towards Accurate Facial Landmark Detection via Cascaded Transformers,Face & Gestures,"['Hui Li', 'Zidong Guo']",['SRCX'],https://openaccess.thecvf.com/content/CVPR2022/papers/Li_Towards_Accurate_Facial_Landmark_Detection_via_Cascaded_Transformers_CVPR_2022_paper.pdf
Towards Semi-Supervised Deep Facial Expression Recognition With an Adaptive Confidence Margin,Face & Gestures,"['Hangyu Li', 'Nannan Wang']",['Xidian'],https://openaccess.thecvf.com/content/CVPR2022/papers/Li_Towards_Semi-Supervised_Deep_Facial_Expression_Recognition_With_an_Adaptive_Confidence_CVPR_2022_paper.pdf
D-Grasp: Physically Plausible Dynamic Grasp Synthesis for Hand-Object Interactions,Face and Gestures,"['Sammy Christen', 'Muhammed Kocabas']",['ETHZ'],https://openaccess.thecvf.com/content/CVPR2022/papers/Christen_D-Grasp_Physically_Plausible_Dynamic_Grasp_Synthesis_for_Hand-Object_Interactions_CVPR_2022_paper.pdf
EMOCA: Emotion Driven Monocular Face Capture and Animation,Face and Gestures,"['Radek Dan\\u011b\\u010dek', 'Michael J. Black']",['MPI-IS'],https://openaccess.thecvf.com/content/CVPR2022/papers/Danecek_EMOCA_Emotion_Driven_Monocular_Face_Capture_and_Animation_CVPR_2022_paper.pdf
FaceVerse: A Fine-Grained and Detail-Controllable 3D Face Morphable Model From a Hybrid Dataset,Face and Gestures,"['Lizhen Wang', 'Zhiyuan Chen']",['THU'],https://openaccess.thecvf.com/content/CVPR2022/papers/Wang_FaceVerse_A_Fine-Grained_and_Detail-Controllable_3D_Face_Morphable_Model_From_CVPR_2022_paper.pdf
gDNA: Towards Generative Detailed Neural Avatars,Face and Gestures,"['Xu Chen', 'Tianjian Jiang']",['ETHZ'],https://openaccess.thecvf.com/content/CVPR2022/papers/Chen_gDNA_Towards_Generative_Detailed_Neural_Avatars_CVPR_2022_paper.pdf
GraFormer: Graph-Oriented Transformer for 3D Pose Estimation,Face and Gestures,"['Weixi Zhao', 'Weiqiang Wang']",[' data-aff='],https://openaccess.thecvf.com/content/CVPR2022/papers/Zhao_GraFormer_Graph-Oriented_Transformer_for_3D_Pose_Estimation_CVPR_2022_paper.pdf
HeadNeRF: A Real-Time NeRF-Based Parametric Head Model,Face and Gestures,"['Yang Hong', 'Bo Peng']",['USTC'],https://openaccess.thecvf.com/content/CVPR2022/papers/Hong_HeadNeRF_A_Real-Time_NeRF-Based_Parametric_Head_Model_CVPR_2022_paper.pdf
ImFace: A Nonlinear 3D Morphable Face Model With Implicit Neural Representations,Face and Gestures,"['Mingwu Zheng', 'Hongyu Yang']",['Beihang'],https://openaccess.thecvf.com/content/CVPR2022/papers/Zheng_ImFace_A_Nonlinear_3D_Morphable_Face_Model_With_Implicit_Neural_CVPR_2022_paper.pdf
Knowledge-Driven Self-Supervised Representation Learning for Facial Action Unit Recognition,Face and Gestures,"['Yanan Chang', 'Shangfei Wang']",['USTC'],https://openaccess.thecvf.com/content/CVPR2022/papers/Chang_Knowledge-Driven_Self-Supervised_Representation_Learning_for_Facial_Action_Unit_Recognition_CVPR_2022_paper.pdf
Learning To Listen: Modeling Non-Deterministic Dyadic Facial Motion,Face and Gestures,"['Evonne Ng', 'Hanbyul Joo']",['UC'],https://openaccess.thecvf.com/content/CVPR2022/papers/Ng_Learning_To_Listen_Modeling_Non-Deterministic_Dyadic_Facial_Motion_CVPR_2022_paper.pdf
LiDARCap: Long-Range Marker-Less 3D Human Motion Capture With LiDAR Point Clouds,Face and Gestures,"['Jialian Li', 'Jingyi Zhang']",[' data-aff='],https://openaccess.thecvf.com/content/CVPR2022/papers/Li_LiDARCap_Long-Range_Marker-Less_3D_Human_Motion_Capture_With_LiDAR_Point_CVPR_2022_paper.pdf
LISA: Learning Implicit Shape and Appearance of Hands,Face and Gestures,"['Enric Corona', 'Tomas Hodan']",['IRI'],https://openaccess.thecvf.com/content/CVPR2022/papers/Corona_LISA_Learning_Implicit_Shape_and_Appearance_of_Hands_CVPR_2022_paper.pdf
Low-Resource Adaptation for Personalized Co-Speech Gesture Generation,Face and Gestures,"['Chaitanya Ahuja', 'Dong Won Lee']",['CMU'],https://openaccess.thecvf.com/content/CVPR2022/papers/Ahuja_Low-Resource_Adaptation_for_Personalized_Co-Speech_Gesture_Generation_CVPR_2022_paper.pdf
Mining Multi-View Information: A Strong Self-Supervised Framework for Depth-Based 3D Hand Pose and Mesh Estimation,Face and Gestures,"['Pengfei Ren', 'Haifeng Sun']",['BUPT'],https://openaccess.thecvf.com/content/CVPR2022/papers/Ren_Mining_Multi-View_Information_A_Strong_Self-Supervised_Framework_for_Depth-Based_3D_CVPR_2022_paper.pdf
MobRecon: Mobile-Friendly Hand Mesh Reconstruction From Monocular Image,Face and Gestures,"['Xingyu Chen', 'Yufeng Liu']",['Kuaishou'],https://openaccess.thecvf.com/content/CVPR2022/papers/Chen_MobRecon_Mobile-Friendly_Hand_Mesh_Reconstruction_From_Monocular_Image_CVPR_2022_paper.pdf
OSSO: Obtaining Skeletal Shape From Outside,Face and Gestures,"['Marilyn Keller', 'Silvia Zuffi']",['MPI-IS'],https://openaccess.thecvf.com/content/CVPR2022/papers/Keller_OSSO_Obtaining_Skeletal_Shape_From_Outside_CVPR_2022_paper.pdf
Physically-Guided Disentangled Implicit Rendering for 3D Face Modeling,Face and Gestures,"['Zhenyu Zhang', 'Yanhao Ge']",['Tencent'],https://openaccess.thecvf.com/content/CVPR2022/papers/Zhang_Physically-Guided_Disentangled_Implicit_Rendering_for_3D_Face_Modeling_CVPR_2022_paper.pdf
PINA: Learning a Personalized Implicit Neural Avatar From a Single RGB-D Video Sequence,Face and Gestures,"['Zijian Dong', 'Chen Guo']",['ETHZ'],https://openaccess.thecvf.com/content/CVPR2022/papers/Dong_PINA_Learning_a_Personalized_Implicit_Neural_Avatar_From_a_Single_CVPR_2022_paper.pdf
RigNeRF: Fully Controllable Neural 3D Portraits,Face and Gestures,"['ShahRukh Athar', 'Zexiang Xu']",['SBU'],https://openaccess.thecvf.com/content/CVPR2022/papers/Athar_RigNeRF_Fully_Controllable_Neural_3D_Portraits_CVPR_2022_paper.pdf
Robust Egocentric Photo-Realistic Facial Expression Transfer for Virtual Reality,Face and Gestures,"['Amin Jourabloo', 'Fernando De la Torre']",['FRL'],https://openaccess.thecvf.com/content/CVPR2022/papers/Jourabloo_Robust_Egocentric_Photo-Realistic_Facial_Expression_Transfer_for_Virtual_Reality_CVPR_2022_paper.pdf
Sparse to Dense Dynamic 3D Facial Expression Generation,Face and Gestures,"['Naima Otberdout', 'Claudio Ferrari']",['Univ.'],https://openaccess.thecvf.com/content/CVPR2022/papers/Otberdout_Sparse_to_Dense_Dynamic_3D_Facial_Expression_Generation_CVPR_2022_paper.pdf
Spatial-Temporal Parallel Transformer for Arm-Hand Dynamic Estimation,Face and Gestures,"['Shuying Liu', 'Wenbin Wu']",['NetEase'],https://openaccess.thecvf.com/content/CVPR2022/papers/Liu_Spatial-Temporal_Parallel_Transformer_for_Arm-Hand_Dynamic_Estimation_CVPR_2022_paper.pdf
Speech Driven Tongue Animation,Face and Gestures,"['Salvador Medina', 'Denis Tome']",['CMU'],https://openaccess.thecvf.com/content/CVPR2022/papers/Medina_Speech_Driven_Tongue_Animation_CVPR_2022_paper.pdf
The Wanderings of Odysseus in 3D Scenes,Face and Gestures,"['Yan Zhang', 'Siyu Tang']",['ETHZ'],https://openaccess.thecvf.com/content/CVPR2022/papers/Zhang_The_Wanderings_of_Odysseus_in_3D_Scenes_CVPR_2022_paper.pdf
Towards Diverse and Natural Scene-Aware 3D Human Motion Synthesis,Face and Gestures,"['Jingbo Wang', 'Yu Rong']",['CUHK'],https://openaccess.thecvf.com/content/CVPR2022/papers/Wang_Towards_Diverse_and_Natural_Scene-Aware_3D_Human_Motion_Synthesis_CVPR_2022_paper.pdf
Uncertainty-Aware Adaptation for Self-Supervised 3D Human Pose Estimation,Face and Gestures,"['Jogendra Nath Kundu', 'Siddharth Seth']",['IISc'],https://openaccess.thecvf.com/content/CVPR2022/papers/Kundu_Uncertainty-Aware_Adaptation_for_Self-Supervised_3D_Human_Pose_Estimation_CVPR_2022_paper.pdf
Unimodal-Concentrated Loss: Fully Adaptive Label Distribution Learning for Ordinal Regression,Face and Gestures,"['Qiang Li', 'Jingjing Wang']",['Hikvision'],https://openaccess.thecvf.com/content/CVPR2022/papers/Li_Unimodal-Concentrated_Loss_Fully_Adaptive_Label_Distribution_Learning_for_Ordinal_Regression_CVPR_2022_paper.pdf
Adversarial Parametric Pose Prior,"Human Pose Estimation & Tracking, Localization, and Object Pose Estimation","['Andrey Davydov', 'Anastasia Remizova']",['EPFL'],https://openaccess.thecvf.com/content/CVPR2022/papers/Davydov_Adversarial_Parametric_Pose_Prior_CVPR_2022_paper.pdf
ARCS: Accurate Rotation and Correspondence Search,"Human Pose Estimation & Tracking, Localization, and Object Pose Estimation","['Liangzu Peng', 'Manolis C. Tsakiris']",['JHU'],https://openaccess.thecvf.com/content/CVPR2022/papers/Peng_ARCS_Accurate_Rotation_and_Correspondence_Search_CVPR_2022_paper.pdf
Bailando: 3D Dance Generation by Actor-Critic GPT With Choreographic Memory,"Human Pose Estimation & Tracking, Localization, and Object Pose Estimation","['Li Siyao', 'Weijiang Yu']",['NTU'],https://openaccess.thecvf.com/content/CVPR2022/papers/Siyao_Bailando_3D_Dance_Generation_by_Actor-Critic_GPT_With_Choreographic_Memory_CVPR_2022_paper.pdf
Contextual Instance Decoupling for Robust Multi-Person Pose Estimation,"Human Pose Estimation & Tracking, Localization, and Object Pose Estimation","['Dongkai Wang', 'Shiliang Zhang']",['PKU'],https://openaccess.thecvf.com/content/CVPR2022/papers/Wang_Contextual_Instance_Decoupling_for_Robust_Multi-Person_Pose_Estimation_CVPR_2022_paper.pdf
End-to-End Multi-Person Pose Estimation With Transformers,"Human Pose Estimation & Tracking, Localization, and Object Pose Estimation","['Dahu Shi', 'Xing Wei']",['HRI'],https://openaccess.thecvf.com/content/CVPR2022/papers/Shi_End-to-End_Multi-Person_Pose_Estimation_With_Transformers_CVPR_2022_paper.pdf
FisherMatch: Semi-Supervised Rotation Regression via Entropy-Based Filtering,"Human Pose Estimation & Tracking, Localization, and Object Pose Estimation","['Yingda Yin', 'Yingcheng Cai']",['Peking'],https://openaccess.thecvf.com/content/CVPR2022/papers/Yin_FisherMatch_Semi-Supervised_Rotation_Regression_via_Entropy-Based_Filtering_CVPR_2022_paper.pdf
Generalizable Human Pose Triangulation,"Human Pose Estimation & Tracking, Localization, and Object Pose Estimation","['Kristijan Bartol', 'David Bojani\\u0107']",['UNIZG'],https://openaccess.thecvf.com/content/CVPR2022/papers/Bartol_Generalizable_Human_Pose_Triangulation_CVPR_2022_paper.pdf
Geometric Transformer for Fast and Robust Point Cloud Registration,"Human Pose Estimation & Tracking, Localization, and Object Pose Estimation","['Zheng Qin', 'Hao Yu']",['NUDT'],https://openaccess.thecvf.com/content/CVPR2022/papers/Qin_Geometric_Transformer_for_Fast_and_Robust_Point_Cloud_Registration_CVPR_2022_paper.pdf
GLAMR: Global Occlusion-Aware Human Mesh Recovery With Dynamic Cameras,"Human Pose Estimation & Tracking, Localization, and Object Pose Estimation","['Ye Yuan', 'Umar Iqbal']",['NVIDIA'],https://openaccess.thecvf.com/content/CVPR2022/papers/Yuan_GLAMR_Global_Occlusion-Aware_Human_Mesh_Recovery_With_Dynamic_Cameras_CVPR_2022_paper.pdf
Keypoint Transformer: Solving Joint Identification in Challenging Hands and Object Interactions for Accurate 3D Pose Estimation,"Human Pose Estimation & Tracking, Localization, and Object Pose Estimation","['Shreyas Hampali', 'Sayan Deb Sarkar']",['TU'],https://openaccess.thecvf.com/content/CVPR2022/papers/Hampali_Keypoint_Transformer_Solving_Joint_Identification_in_Challenging_Hands_and_Object_CVPR_2022_paper.pdf
LASER: LAtent SpacE Rendering for 2D Visual Localization,"Human Pose Estimation & Tracking, Localization, and Object Pose Estimation","['Zhixiang Min', 'Naji Khosravan']",['SIT'],https://openaccess.thecvf.com/content/CVPR2022/papers/Min_LASER_LAtent_SpacE_Rendering_for_2D_Visual_Localization_CVPR_2022_paper.pdf
Learning To Detect Scene Landmarks for Camera Localization,"Human Pose Estimation & Tracking, Localization, and Object Pose Estimation","['Tien Do', 'Ondrej Miksik']",['UMN'],https://openaccess.thecvf.com/content/CVPR2022/papers/Do_Learning_To_Detect_Scene_Landmarks_for_Camera_Localization_CVPR_2022_paper.pdf
Meta Agent Teaming Active Learning for Pose Estimation,"Human Pose Estimation & Tracking, Localization, and Object Pose Estimation","['Jia Gong', 'Zhipeng Fan']",['SUTD'],https://openaccess.thecvf.com/content/CVPR2022/papers/Gong_Meta_Agent_Teaming_Active_Learning_for_Pose_Estimation_CVPR_2022_paper.pdf
Not All Tokens Are Equal: Human-Centric Visual Analysis via Token Clustering Transformer,"Human Pose Estimation & Tracking, Localization, and Object Pose Estimation","['Wang Zeng', 'Sheng Jin']",['CUHK'],https://openaccess.thecvf.com/content/CVPR2022/papers/Zeng_Not_All_Tokens_Are_Equal_Human-Centric_Visual_Analysis_via_Token_CVPR_2022_paper.pdf
Occlusion-Robust Face Alignment Using a Viewpoint-Invariant Hierarchical Network Architecture,"Human Pose Estimation & Tracking, Localization, and Object Pose Estimation","['Congcong Zhu', 'Xintong Wan']",['SHU'],https://openaccess.thecvf.com/content/CVPR2022/papers/Zhu_Occlusion-Robust_Face_Alignment_Using_a_Viewpoint-Invariant_Hierarchical_Network_Architecture_CVPR_2022_paper.pdf
"PoseTriplet: Co-Evolving 3D Human Pose Estimation, Imitation, and Hallucination Under Self-Supervision","Human Pose Estimation & Tracking, Localization, and Object Pose Estimation","['Kehong Gong', 'Bingbing Li']",['NUS'],https://openaccess.thecvf.com/content/CVPR2022/papers/Gong_PoseTriplet_Co-Evolving_3D_Human_Pose_Estimation_Imitation_and_Hallucination_Under_CVPR_2022_paper.pdf
Temporal Feature Alignment and Mutual Information Maximization for Video-Based Human Pose Estimation,"Human Pose Estimation & Tracking, Localization, and Object Pose Estimation","['Zhenguang Liu', 'Runyang Feng']",['ZJU'],https://openaccess.thecvf.com/content/CVPR2022/papers/Liu_Temporal_Feature_Alignment_and_Mutual_Information_Maximization_for_Video-Based_Human_CVPR_2022_paper.pdf
Uni6D: A Unified CNN Framework Without Projection Breakdown for 6D Pose Estimation,"Human Pose Estimation & Tracking, Localization, and Object Pose Estimation","['Xiaoke Jiang', 'Donghai Li']",['SenseTime'],https://openaccess.thecvf.com/content/CVPR2022/papers/Jiang_Uni6D_A_Unified_CNN_Framework_Without_Projection_Breakdown_for_6D_CVPR_2022_paper.pdf
3D-Aware Image Synthesis via Learning Structural and Textural Representations,Image & Video Synthesis and Generation,"['Yinghao Xu', 'Sida Peng']",['CUHK'],https://openaccess.thecvf.com/content/CVPR2022/papers/Xu_3D-Aware_Image_Synthesis_via_Learning_Structural_and_Textural_Representations_CVPR_2022_paper.pdf
A Brand New Dance Partner: Music-Conditioned Pluralistic Dancing Controlled by Multiple Dance Genres,Image & Video Synthesis and Generation,"['Jinwoo Kim', 'Heeseok Oh']",['Yonsei'],https://openaccess.thecvf.com/content/CVPR2022/papers/Kim_A_Brand_New_Dance_Partner_Music-Conditioned_Pluralistic_Dancing_Controlled_by_CVPR_2022_paper.pdf
A Style-Aware Discriminator for Controllable Image Translation,Image & Video Synthesis and Generation,"['Kunhee Kim', 'Sanghun Park']",['POSTECH'],https://openaccess.thecvf.com/content/CVPR2022/papers/Kim_A_Style-Aware_Discriminator_for_Controllable_Image_Translation_CVPR_2022_paper.pdf
Alleviating Semantics Distortion in Unsupervised Low-Level Image-to-Image Translation via Structure Consistency Constraint,Image & Video Synthesis and Generation,"['Jiaxian Guo', 'Jiachen Li']",['USYD'],https://openaccess.thecvf.com/content/CVPR2022/papers/Guo_Alleviating_Semantics_Distortion_in_Unsupervised_Low-Level_Image-to-Image_Translation_via_Structure_CVPR_2022_paper.pdf
AR-NeRF: Unsupervised Learning of Depth and Defocus Effects From Natural Images With Aperture Rendering Neural Radiance Fields,Image & Video Synthesis and Generation,"['Takuhiro Kaneko', 'Evangelos Ntavelis']",['NTT'],https://openaccess.thecvf.com/content/CVPR2022/papers/Kaneko_AR-NeRF_Unsupervised_Learning_of_Depth_and_Defocus_Effects_From_Natural_CVPR_2022_paper.pdf
Arbitrary-Scale Image Synthesis,Image & Video Synthesis and Generation,"['Evangelos Ntavelis', 'Mohamad Shahbazi']",['ETHZ'],https://openaccess.thecvf.com/content/CVPR2022/papers/Ntavelis_Arbitrary-Scale_Image_Synthesis_CVPR_2022_paper.pdf
Attribute Group Editing for Reliable Few-Shot Image Generation,Image & Video Synthesis and Generation,"['Guanqi Ding', 'Xinzhe Han']",['UCAS'],https://openaccess.thecvf.com/content/CVPR2022/papers/Ding_Attribute_Group_Editing_for_Reliable_Few-Shot_Image_Generation_CVPR_2022_paper.pdf
Audio-Driven Neural Gesture Reenactment With Video Motion Graphs,Image & Video Synthesis and Generation,"['Yang Zhou', 'Jimei Yang']",['UMass'],https://openaccess.thecvf.com/content/CVPR2022/papers/Zhou_Audio-Driven_Neural_Gesture_Reenactment_With_Video_Motion_Graphs_CVPR_2022_paper.pdf
Autoregressive Image Generation Using Residual Quantization,Image & Video Synthesis and Generation,"['Doyup Lee', 'Chiheon Kim']",['POSTECH'],https://openaccess.thecvf.com/content/CVPR2022/papers/Lee_Autoregressive_Image_Generation_Using_Residual_Quantization_CVPR_2022_paper.pdf
Bi-Level Doubly Variational Learning for Energy-Based Latent Variable Models,Image & Video Synthesis and Generation,"['Ge Kan', 'Jinhu L\\u00fc']",['BUAA'],https://openaccess.thecvf.com/content/CVPR2022/papers/Kan_Bi-Level_Doubly_Variational_Learning_for_Energy-Based_Latent_Variable_Models_CVPR_2022_paper.pdf
Blended Diffusion for Text-Driven Editing of Natural Images,Image & Video Synthesis and Generation,"['Omri Avrahami', 'Dani Lischinski']",['HUJI'],https://openaccess.thecvf.com/content/CVPR2022/papers/Avrahami_Blended_Diffusion_for_Text-Driven_Editing_of_Natural_Images_CVPR_2022_paper.pdf
Blind Face Restoration via Integrating Face Shape and Generative Priors,Image & Video Synthesis and Generation,"['Feida Zhu', 'Junwei Zhu']",['Tencent'],https://openaccess.thecvf.com/content/CVPR2022/papers/Zhu_Blind_Face_Restoration_via_Integrating_Face_Shape_and_Generative_Priors_CVPR_2022_paper.pdf
BodyGAN: General-Purpose Controllable Neural Human Body Generation,Image & Video Synthesis and Generation,"['Chaojie Yang', 'Hanhui Li']",['Momo'],https://openaccess.thecvf.com/content/CVPR2022/papers/Yang_BodyGAN_General-Purpose_Controllable_Neural_Human_Body_Generation_CVPR_2022_paper.pdf
Brain-Supervised Image Editing,Image & Video Synthesis and Generation,"['Keith M. Davis III', 'Carlos de la Torre-Ortiz']",['UH'],https://openaccess.thecvf.com/content/CVPR2022/papers/Davis_Brain-Supervised_Image_Editing_CVPR_2022_paper.pdf
Bridging Global Context Interactions for High-Fidelity Image Completion,Image & Video Synthesis and Generation,"['Chuanxia Zheng', 'Tat-Jen Cham']",['Monash'],https://openaccess.thecvf.com/content/CVPR2022/papers/Zheng_Bridging_Global_Context_Interactions_for_High-Fidelity_Image_Completion_CVPR_2022_paper.pdf
Cluster-Guided Image Synthesis With Unconditional Models,Image & Video Synthesis and Generation,"['Markos Georgopoulos', 'James Oldfield']",['ICL'],https://openaccess.thecvf.com/content/CVPR2022/papers/Georgopoulos_Cluster-Guided_Image_Synthesis_With_Unconditional_Models_CVPR_2022_paper.pdf
